news_headline,news_article,news_category
Crypto exchange Coinbase valued at $68 bn ahead of US listing,"Coinbase, the largest US cryptocurrency exchange, said it has been valued at $68 billion ahead of its planned stock market listing. The company has registered about 114.9 million shares for its listing, as per a regulatory filing. Coinbase's valuation has jumped almost 13-fold between the third quarter ended September 30 and the first quarter of 2021.","['https:', '', 'inshorts.com', 'en', 'read', 'startup']"
"Amazon, Flipkart hell bent on destroying retail sector: CAIT","Confederation of All India Traders (CAIT) in a letter to Union Minister Piyush Goyal said, ""Foreign entities like Amazon and Flipkart are hell bent on ruthlessly destroying the Indian retail sector."" It further said the companies are ""grossly and blatantly"" violating Press Note No 2 of FDI Policy 2016/2018. It also accused them of treating India as a ""banana republic"".","['https:', '', 'inshorts.com', 'en', 'read', 'startup']"
OYO India business now EBITDA positive: CEO Ritesh Agarwal,"OYO's India business is now EBITDA positive and the company is earning the same gross profits globally since January 2021 as it did in the pre-COVID period, CEO Ritesh Agarwal said. India is the second market, after OYO Europe Homes, that has achieved profitability, Agarwal added. He said profits will get stronger in 2021 as lockdowns ease and vaccination increases.","['https:', '', 'inshorts.com', 'en', 'read', 'startup']"
"7,000 new startups founded in India in 2020: Report","A new report by Bain and Company found that venture capital (VC) investments in India touched $10 billion during 2020, and 7,000 new startups were founded despite the pandemic. It reported that consumer tech, Software-as-a-Service (SaaS), and fintech attracted 75% of the total VC funding last year, and that the number of VC deals rose by 7% in 2020. ","['https:', '', 'inshorts.com', 'en', 'read', 'startup']"
Startups bring in creative destruction in economy: CEA Subramanian,"India's Chief Economic Adviser Krishnamurthy Subramanian said startups are very important because they bring in creative destruction, which is very important in any capitalist economy. He added that startups keep the incumbents on their toes and force them to innovate. He said India's 100 unicorns are built on the quality of their ideas instead of connections or dynastic successions. ","['https:', '', 'inshorts.com', 'en', 'read', 'startup']"
Pixxel to build high resolution hyperspectral smallsat constellation,"Space startup Pixxel on Wednesday announced it will build the ""world's highest resolution hyperspectral satellite constellation"". The startup aims to do so with the help of a small satellite constellation that will provide 24-hour, global coverage once it's fully operational. Pixxel aims to launch its first hyperspectral satellite in the next few months.","['https:', '', 'inshorts.com', 'en', 'read', 'startup']"
"MyGlamm raises ₹175 crore led by Amazon, Wipro and Ascent","Direct-to-consumer beauty brand MyGlamm on Thursday said it closed a ₹175 crore Series C round led by Amazon, Wipro Consumer and Ascent Capital. The Mumbai-based omni-channel company founded by Darpan Sanghvi had previously raised ₹100 crore in June 2019. This fresh infusion of capital pegs MyGlamm's value at $100 million, and marks Amazon's first investment in an Indian consumer brand. ","['https:', '', 'inshorts.com', 'en', 'read', 'startup']"
Policybazaar raises $75 mn in latest round led by Falcon Edge,Online insurance aggregator Policybazaar's CEO Sarbvir Singh confirmed that the company had raised $75 million in a funding round led by Falcon Edge. The 12-year-old company has raised $630 million to date and plans to go public by September 2021 at a valuation of $3.5 billion. The funds will reportedly be used to expand in the Middle East. ,"['https:', '', 'inshorts.com', 'en', 'read', 'startup']"
